<?xml version="1.0" encoding="UTF-8"?>
<!DOCTYPE material SYSTEM "Tarefa_6_C.dtd" >

<material>

 <libro ISBN="X9-8998">
       <titulo>Inverno na Pereira</titulo>
       <editorial>Toxo verde</editorial>
       <autor>Xurxo Cancelas Brión</autor>
       <ano>2008</ano>
 </libro> 
 
 <artigo>
       <titulo>O carballo</titulo>
       <revista numero="32">
           <nome>Natureza Verde</nome>
           <paxina>4</paxina>
       </revista>
 </artigo> 
 
</material>